Question,Answer
"If you observe frequent occurrences of lte-rrc.bandParametersDL_v10i0 == 0, what potential issues should you investigate regarding the LTE network configuration?","Frequent occurrences of `lte-rrc.bandParametersDL_v10i0 == 0` suggest potential issues such as misconfigurations in the network setup, lack of optimization for specific bands, or incomplete deployment. Investigate whether the network's band parameters are correctly configured and aligned with intended operational requirements. Check if there is a deliberate design choice to use default settings due to compatibility or resource constraints."
What are potential troubleshooting actions if a PCAP analysis reveals multiple instances of 'lte-rrc.b2_Threshold2_UTRA > 30' during attempted UTRA handovers?,Potential actions include: 1) Reviewing and adjusting the threshold value to ensure it is set appropriately for current network conditions. 2) Analyzing signal strength data around failure times to understand if environmental factors affect measurements. 3) Consulting with network planning teams to possibly redesign cell coverage or adjust overlapping configurations.
Explain what the 'diameter.3gpp.air_flags_bit0' field represents in Diameter protocol and its significance when set to False.,"'diameter.3gpp.air_flags_bit0' is a flag within the Diameter protocol used specifically in 3GPP contexts, representing whether User Equipment (UE) usage type information is being sent or not. When this field is set to False, it indicates that the UE usage type information is not transmitted, which could point to potential configuration issues with user equipment."
"What are some potential causes for an SM-Back-Off-Timer value being set above 3600 milliseconds, and how would you investigate this using PCAP analysis?","Potential causes include misconfigurations or overly conservative retry strategies. To investigate, capture packets with tcpdump focusing on Diameter traffic (e.g., `tcpdump -i any udp port 3868`). Then analyze the PCAP file to extract and examine SM-Back-Off-Timer values using a packet analysis tool capable of parsing Diameter attributes."
Describe the purpose of the VCI (Virtual Channel Identifier) and VPI (Virtual Path Identifier) fields in the context of ATM networks.,"In ATM networks, the VCI (Virtual Channel Identifier) is used to identify a virtual channel within a virtual path. The VPI (Virtual Path Identifier), on the other hand, identifies a bundle of multiple channels as one logical unit. Together, they enable multiplexing and efficient routing of data over the network by specifying exact paths for packets."
How can you differentiate between packet loss and retransmissions using DTLS sequence numbers and epochs?,"Packet loss is identified when sequence numbers are missing from the expected range without subsequent appearance, indicating they were not received. Retransmissions appear as repeated sequence numbers within the same epoch or session, where packets initially lost are resent to ensure data integrity."
"In the context of LTE networks operating in an EN-DC setup, what potential network issues could be inferred from detecting a value of '1' for 'lte-rrc.inDeviceCoexInd_ENDC_r15', and how would you verify these using PCAP analysis?","Detecting a value of '1' for 'lte-rrc.inDeviceCoexInd_ENDC_r15' in an EN-DC setup could infer potential interference or coexistence issues between LTE and 5G networks. To verify these, use PCAP analysis to examine related protocol messages such as RRC signaling, channel quality measurements (e.g., Reference Signal Received Power - RSRP), and Handover (HO) statistics. Analyzing patterns in these fields can help identify the sources of interference or misconfigurations affecting network performance."
"Given a scenario where both 'lte-rrc.sc_mtch_InfoList_r13' and 'lte-rrc.sc_mtch_InfoList_r14' fields exceed 1000, what additional packet fields might you examine to diagnose the root cause of excessive multicast traffic?","In such scenarios, examine these additional packet fields: 
1. Source/ Destination IP addresses: To identify if specific nodes or services are generating high traffic.
2. Protocol Type and Ports: To determine types of applications causing high multicast traffic.
3. Sequence Numbers and Acknowledgments (for TCP): To check for retransmissions indicating network issues.
4. Time to Live (TTL) Values: To detect potential routing loops or misconfigurations."
"How would you construct a Wireshark filter to identify packets where the 'lte-rrc.shortTTI_r15' field is set to false, indicating that short TTI is disabled?","In Wireshark, you can use the following display filter to identify packets with 'lte-rrc.shortTTI_r15' set to false: `lte-rrc.shortTTI_r15 == 0`. This filter will show only those packets where the short TTI is disabled."
Describe how you would verify if a particular network segment is using the Extended Macro eNodeB ID by analyzing GTPv2 packets. What are potential indicators of misconfigurations or issues related to this setting in your analysis?,"To verify if a network segment uses Extended Macro eNodeB IDs, follow these steps: 
1. **Capture and Filter**: Capture traffic from the segment and apply `gtpv2.uli_ext_macro_enb_id_flg == 1` to filter relevant packets.
2. **Pattern Analysis**: Analyze patterns of usage; consistent presence across expected devices suggests correct use.
3. **Cross-Check with Configurations**: Compare observed identifiers against network configuration documents.
Potential indicators of misconfigurations include inconsistent identifier usage, unexpected high frequency indicating potential loop issues, or absence in segments where they are expected."
What troubleshooting steps should a network administrator take upon identifying an unspecified IPv6 address in Diameter messages when diagnosing connectivity issues with Mobile IP services?,"Upon identification, the administrator should verify DHCPv6 server configurations, check for correct IPv6 address assignments on network devices, and ensure proper routing settings. Reviewing logs from the DHCPv6 server can help pinpoint where the assignment process might be failing."
"In what scenarios might you encounter an 'http.body.fragment == 0' value, and how can this information help troubleshoot network problems?","'http.body.fragment == 0' signifies the end of a chunked transfer. Encountering this value helps confirm that no more data chunks are expected. If encountered unexpectedly or prematurely, it may indicate truncated transfers or communication interruptions, which can assist in diagnosing incomplete data delivery or premature connection closures."
"In an LTE network, what potential issues might arise if 'lte-rrc.logicalChannelConfig' is set to 0, and how would this affect data transmission?","If 'lte-rrc.logicalChannelConfig' is set to 0, it indicates that a logical channel is not configured properly. This can lead to failures in establishing or maintaining radio bearers needed for data transmission, potentially resulting in dropped connections, degraded service quality, and inability to transmit/receive data."
How would you construct a Wireshark filter to identify GSM RLC MAC downlink GPRS measurement parameter packets with high quantization values (greater than 10) for FDD networks?,"To construct a Wireshark filter for identifying these packets, use the following expression: `gsm_rlcmac.dl.gprsmeasurementparams3g_repquantfdd > 10`. This filters out packets where the GPRS measurement parameter quantization value exceeds 10."
"In what ways can repeated failures in Billing Policy Installations affect customer experience and service delivery, based on your analysis of network traffic?","Repeated failures can lead to incorrect billing statements, causing confusion and dissatisfaction among customers. Delays or inaccuracies in applying new policies might result in services being incorrectly charged or billed, affecting trust and potentially leading to increased churn rates. Service disruptions due to policy misconfigurations could further degrade the customer experience."
Explain the impact of configuring both Short TTI and SPT on latency and throughput within an LTE network.,"Configuring both Short TTI and SPT can significantly reduce latency by enabling more frequent transmission opportunities, which is beneficial for applications that require low-latency communication. However, while this setup may improve responsiveness and reduce delay, it could lead to increased signaling overhead or resource allocation challenges, potentially impacting overall throughput if not managed properly."
Describe how you would construct a tcpdump filter to monitor for both 'Complete Detach' and 'RAT Change Failure' events using GTPv2 Cause Types.,"To construct a tcpdump filter that monitors for both 'Complete Detach' (value 2) and 'RAT Change Failure' (value 3) events, you would use the following filter: `tcpdump -i any 'port 2123 or port 8805' and '((udp[48] & 0x7F00) >> 8 == 2 or ((udp[48] & 0x7F00) >> 8 == 3))'`. This captures packets on the GTP ports (2123 for tunnelled, 8805 for non-tunnelled) where the cause type field indicates either a Complete Detach or RAT Change Failure."
"In what scenarios might an EGPRS packet be assigned an access technology type value outside of {0, 1, 2}, and how can this be detected using Wireshark?","An EGPRS packet might be assigned an invalid access technology type due to misconfiguration in network equipment or software errors. Such scenarios can be detected by applying the Wireshark filter `gsm_rlcmac.dl.pua_egprs_00_access_tech_type_exist == 1 && gsm_rlcmac.dl.pua_egprs_00_access_tech_type not in {0, 1, 2}`, which will highlight packets with non-standard values."
How would you construct a Wireshark filter to identify packets where Short TTI and SPT are configured in an LTE network?,"To identify packets where Short TTI and SPT are configured, use the Wireshark display filter: `lte-rrc.mAC_MainConfig.eag_9.shortTTI_AndSPT_r14.setup == True`. This filter specifically targets RRC (Radio Resource Control) protocol messages that indicate the setup of these configurations."
What are some troubleshooting steps you can take using Wireshark/tcpdump when an LTE device shows SCells as deactivated even though the user reports connectivity issues?,"Troubleshooting steps include: 1) Capturing and analyzing RRC signaling messages for errors or misconfigurations. 2) Verifying MAC layer messages to check if activation requests are being sent and acknowledged. 3) Checking network element configurations that manage SCell activations, such as eNodeBs. 4) Monitoring radio link quality indicators to see if poor conditions might prevent SCell activation."
How would you differentiate between normal latency variations and those induced by Short TTI using packet capture data?,Differentiate between normal latency variations and those induced by Short TTI by analyzing the timing of packets before and after enabling Short TTI. Use PCAP data to calculate RTT for a significant number of packets over time. Increased jitter or consistent shortening of RTT post-Short TTI activation suggests an impact from this configuration. Comparing these metrics against network load patterns can help distinguish between typical variations and those specifically caused by the change.
How can analyzing the 'diameter.Active-Product-Offer' field help in detecting anomalies or misconfigurations in a telecommunications network?,"Analyzing the diameter.Active-Product-Offer field helps detect anomalies or misconfigurations by revealing patterns such as unexpected empty sequences, inconsistencies across sessions, or deviations from expected product offers. This analysis can highlight issues like incorrect policy enforcement, communication breakdowns between Diameter nodes, or provisioning errors that may not be apparent through other means."
"What does the field 'gtp.tr_comm' represent in GTP protocol analysis, and why is it significant for diagnosing network issues?","The field 'gtp.tr_comm' represents the transfer command in the GTP (GPRS Tunneling Protocol) header. It indicates specific commands or messages being transferred between nodes within a mobile network. This field is crucial for diagnosing network issues because it provides insight into the types of control and signaling information being communicated, which can affect data flow and session management."
"What is the significance of the field 'lte-rrc.sib_StandaloneLocation_r15' being set to 1, and how might it affect network performance or service quality?","The field `lte-rrc.sib_StandaloneLocation_r15` indicates whether standalone location services are enabled (`value = 1`). When set to 1, the network relies on local measurements for positioning rather than using external signals. This can impact network performance by potentially reducing location accuracy and service availability if external signals are not available or reliable."
"What are some possible reasons for a reduction in the number of component carriers in the uplink as indicated by lte-rrc.reducedCCsUL > 0, and how can these be identified from packet captures?","Possible reasons include network congestion, interference, resource allocation inefficiencies, hardware malfunctions, or configuration errors. These can be identified by correlating `lte-rrc.reducedCCsUL` events with other metrics such as RSRP, SINR values, error rates, or specific protocol messages indicating handovers or reconfigurations."
"What does an lte-rrc.antennaPortsCount value of less than 2 indicate about an LTE network's MIMO capabilities, and how might this affect user experience?","An `lte-rrc.antennaPortsCount` value of less than 2 indicates insufficient antenna ports for supporting Multiple Input Multiple Output (MIMO) technology. This can degrade network performance as MIMO is used to enhance data throughput and signal quality by using multiple antennas at both the transmitter and receiver ends. A lack of sufficient antenna ports might lead to reduced data rates, poorer coverage, and increased latency, negatively affecting user experience."
How would you construct a Wireshark filter to identify packets with an empty `diameter.Service-Selection` field?,"To construct a Wireshark filter for identifying packets with an empty `diameter.Service-Selection` field, use the following filter expression: `diameter.Service-Selection == ''`. This filter checks for Diameter protocol messages where the `Service-Selection` attribute is not specified."
How would you use tcpdump to capture traffic that shows significant downlink packet discards based on the provided filter conditions?,"To use tcpdump for capturing traffic with significant downlink packet discards, apply: `tcpdump -i any 'gtp and (gtp.ext_hdr.nr_ran_cont.dl_disc_nr_pdcp_pdu_sn_start > 1000 or gtp.ext_hdr.nr_ran_cont.dl_disc_num_blks > 10)'`. Adjust `-i` as needed for the specific interface."
What does a value greater than 50 for the 'interferenceMeasRestriction_r13' field in an LTE RRC PDU indicate about network conditions?,"A value greater than 50 for the 'interferenceMeasRestriction_r13' field indicates high interference measurement restrictions, suggesting that the network is experiencing significant interference. This can lead to degraded network performance as it limits the ability of the network to accurately measure and manage interference."
Describe the steps involved in using tcpdump to capture packets that indicate 'High' values for LTE RRC UE-based Network Performance Measurement Parameters. What fields would be most relevant to include in your filter?,"To use tcpdump for capturing such packets, first identify the network interface and IP addresses involved. Use a command like `tcpdump -i <interface> 'lte-rrc.ue_BasedNetwPerfMeasParameters_v1800 == ""High""'`. Relevant fields include protocol identifiers, source/destination IPs or MACs, and specific LTE RRC message types."
How would you construct a Wireshark filter to identify packets where the LTE RRC parameter q_QualMinRSRQ_OnAllSymbols_r12 indicates poor signal quality?,"To construct a Wireshark filter for identifying packets with poor signal quality indicated by an RSRQ value less than -11, use the following expression: `lte-rrc.q_QualMinRSRQ_OnAllSymbols_r12 < -11`. This filter will select all packets where this LTE RRC parameter falls below the threshold indicating poor signal quality."
"What role do lte-rrc.nas_SecurityParamFromEUTRA and lte-rrc.nas_SecurityParamToEUTRA fields play in ensuring secure communication between UE and LTE network, and how can their mismatch affect this process?","These fields define security parameters necessary for encryption and authentication. A mismatch means the UE and network cannot establish a secure link, resulting in failed handovers or connection setups."
"In the context of the Diameter protocol, what does it mean when the Credit-Control-Failure-Handling field is set to '2'?","When the Credit-Control-Failure-Handling field in a Diameter message is set to '2', it means that the system should terminate the session immediately upon a credit control failure. This setting is used as a security measure to prevent unauthorized usage of network resources by ensuring sessions are not continued without sufficient credits."
What additional metrics or protocols might you analyze alongside 'lte-rrc.ss_CCH_InterfHandl_r11' to gain a comprehensive understanding of interference sources on LTE control channels?,"To gain a comprehensive understanding, consider analyzing additional metrics such as RSRP (Reference Signal Received Power), RSRQ (Reference Signal Received Quality), SINR (Signal-to-Interference-plus-Noise Ratio), and UE (User Equipment) mobility patterns. Protocols like RRC, PDCP, and measurements for neighboring cells can provide insights into interference sources and help correlate them with 'lte-rrc.ss_CCH_InterfHandl_r11' values."
"What troubleshooting steps would you take upon identifying missing UE capability reports using the specified filter conditions, and how might these affect user experience?","Upon identifying missing UE capability reports, the following troubleshooting steps could be taken: 1) Verify network configuration to ensure correct signaling settings. 2) Check for firmware updates or bugs in the UE that may affect capability reporting. 3) Examine logs from both the UE and eNodeB for any errors related to EUTRA capability exchanges. These issues might lead to degraded user experience due to poor connectivity, reduced data rates, or intermittent service outages."
Explain the role of the Base Station Identity Code (BSIC) in GSM networks and how mismatches can affect handover processes.,"The Base Station Identity Code (BSIC) is a unique identifier used in GSM networks to distinguish between different base stations, especially in areas with overlapping coverage. It consists of an ARFCN (Absolute Radio Frequency Channel Number), BSID (Base Station Identifier), and NCC (Network Colour Code). During handovers, the mobile device uses BSIC to identify and switch to a target cell. Mismatches can disrupt this process, causing authentication errors or preventing successful connection to the new cell, leading to dropped calls or loss of data connectivity."
Describe a method to quantify the impact of PDN Connection IE Errors on network performance by analyzing PCAP files.,"To quantify the impact, you can start by counting occurrences of `gtpv2.pce == true` over time using Wireshark's statistical tools. Correlate these occurrences with session setup times and failure rates to assess their impact on user connectivity. Additionally, measure network throughput and latency during periods with high error counts compared to normal operations."
How can you use PCAP analysis to diagnose issues arising from mismatched Binding Input and Output Lists in Diameter messages?,"By analyzing the captured packets, compare the `diameter.Binding-Input-List` with `diameter.Binding-Output-List` for each session. Look for patterns such as dropped or altered attributes, timestamps to identify delays, and correlate these issues with network logs or configurations to diagnose potential causes."
Describe the impact of invalid GSM GMSK multislot power profile values on signal quality and overall communication reliability.,"Invalid GSM GMSK multislot power profile values can cause improper power control, leading to degraded signal quality. This degradation may result in higher error rates, dropped calls, reduced data throughput, and generally unreliable communication within the network."
Describe how you would use packet captures to troubleshoot scheduling issues caused by high SRS offset values in an LTE network.,"To troubleshoot scheduling issues from high SRS offset values using packet captures, first filter and analyze packets with offsets exceeding 100 using filters like `lte-rrc.pSRS_Offset > 100`. Examine the timing of uplink transmissions relative to expected slots. Identify patterns or specific conditions causing high offsets, correlate these with user reports or logs of degraded performance, and verify if adjustments in configuration can bring offsets within optimal ranges."
How can you differentiate between PDN Connection IE Errors and other types of errors using the 'gtpv2.pce' field in PCAP analysis?,"'Gtpv2.pce == true' specifically identifies PDN Connection Information Element (IE) Errors. To differentiate these from other GTPv2 errors, you would need to analyze additional fields related to specific error codes or message types within the GTPv2 protocol that are not captured by `gtpv2.pce`. This involves examining the detailed contents of the IE and associated GTP messages."
How can analyzing the lte-rrc.blackCellsToAddModList and lte-rrc.blackCellsToRemoveList fields help identify configuration issues leading to LTE handover failures?,"Analyzing these fields helps identify whether cells are being appropriately added or removed from the blacklist. If no changes occur (`== 0`) despite poor network conditions, it may indicate a misconfiguration that prevents dynamic cell management, contributing to handover failures."
"What are the potential impacts on communication if DTLS records have invalid lengths, and how can these be identified in network traffic analysis?","Invalid DTLS record lengths can lead to incomplete or corrupted data delivery, causing communication failures or security vulnerabilities. These issues can be identified by analyzing packet captures for repeated occurrences of `dtls.record.length.invalid == true`, inspecting reassembly errors at the application layer, and observing any anomalies in handshake completion times or error messages indicating failed connections."
"In network diagnostics, how could the presence of packets with diameter.MBMS-GW-Address.IPv6 set to :: impact the performance and reliability of MBMS services? What corrective measures would you propose?","The presence of such packets can significantly impair the performance and reliability of MBMS services as it may prevent proper routing and data delivery. Corrective measures include reconfiguring the MBMS Gateway with valid IPv6 addresses, verifying network configurations, and testing connectivity to ensure that all components are reachable."
What troubleshooting steps should be taken if an LTE network shows frequent instances of lte-rrc.antennaPortsCount values less than 2 in captured PCAP files?,"If an LTE network frequently reports `lte-rrc.antennaPortsCount` values less than 2, the following troubleshooting steps are recommended: 1) Verify the hardware configurations to ensure all antennas and ports are correctly installed and operational. 2) Check for firmware updates that might resolve any software-related issues causing improper reporting of antenna port counts. 3) Review network configuration settings related to MIMO capabilities. 4) Conduct site surveys to identify environmental factors impacting signal quality. 5) Consider upgrading or replacing hardware components if they are found insufficient for current network demands."
"What are the implications of an empty 'http2.headers.proxy_authenticate' header on the client-server communication process, particularly concerning security protocols?","An empty 'http2.headers.proxy_authenticate' header implies that authentication challenges aren't being issued. This undermines security by allowing unauthenticated access or indicating potential proxy misconfigurations, leaving communications vulnerable to unauthorized access."
"What does it mean when the 'lte-rrc.cqi_ReportConfigPCell_v1250_element' value is set to 'configured', and why is this important for LTE network performance?","When the 'lte-rrc.cqi_ReportConfigPCell_v1250_element' value is set to 'configured', it indicates that CQI (Channel Quality Indicator) reporting has been established for the primary cell. This configuration is crucial as it enables the assessment of link quality and informs scheduling decisions by providing necessary feedback about channel conditions, thereby optimizing network performance."
Describe a troubleshooting approach to identify why there might be frequent 'error' messages in uplink DCCH transmissions in an LTE network.,"A troubleshooting approach for frequent 'error' messages in uplink DCCH transmissions could include: 1) Analyzing the captured PCAP files to determine if errors correlate with specific times, devices, or network areas. 2) Checking device logs and configurations for any anomalies or misconfigurations. 3) Reviewing base station and core network logs for error patterns or alerts. 4) Investigating physical layer issues such as signal strength and interference. 5) Conducting tests during off-peak hours to see if errors persist. 6) Consulting with vendors or using diagnostic tools provided by the LTE equipment manufacturers."
