Question,Answer
How would you construct a Wireshark filter to identify LTE RRC packets with potential misconfigurations in MIMO usage due to lte-rrc.codebookConfigN1_r13 values greater than 1000?,"To construct a Wireshark filter for identifying LTE RRC packets where `lte-rrc.codebookConfigN1_r13` values are greater than 1000, you can use the following expression: `lte-rrc.codebookConfigN1_r13 > 1000`. This filter will isolate packets that meet the condition and help identify potential misconfigurations in MIMO usage."
What does the presence of start timestamps before '2023-01-01T00:00:00Z' in gtpv2.secondary_rat_usage_data_report packets indicate about the data's accuracy and reliability?,"The presence of start timestamps before '2023-01-01T00:00:00Z' indicates that the timestamp data may be outdated or incorrect. Such anomalies can affect the accuracy and reliability of the data analysis, as they suggest potential issues with how the timestamps are recorded or transmitted, possibly pointing to misconfigurations or errors in the system generating these reports."
Explain the significance of monitoring the 'SN-Tp-Uplk-Burst-Size' field in Diameter packets for diagnosing potential network issues.,"Monitoring the 'SN-Tp-Uplk-Burst-Size' field is significant because it helps diagnose potential network congestion or capacity issues. By tracking burst sizes, network administrators can identify patterns that may suggest overutilization of bandwidth, inefficiencies in traffic handling, or other anomalies that could impact service quality."
What Wireshark filter syntax would you use to isolate GTPv2 packets that indicate potential RNC configuration errors?,"To isolate GTPv2 packets indicating potential RNC configuration errors, the Wireshark filter syntax is `gtpv2.tra_info_lne_rnc == 0`. This filter specifically targets packets where the 'gtpv2.tra_info_lne_rnc' field value is zero, suggesting a misconfiguration or lack of RNC information."
"In a network analysis task, how would you differentiate between intentional use of '0.0.0.0' or '::' in GTPv2 HSGW address fields versus configuration errors?","Differentiating between intentional and erroneous use requires context: Intentional use might be documented for specific scenarios such as default route settings, whereas configuration errors typically lack documentation and are accompanied by connectivity issues. Reviewing network policies and documentation can clarify intent."
What are the potential network performance issues indicated by consistently low values (less than 10) in lte-rrc.cqi_Reporting_r14 field during LTE communication?,"Consistently low values (<10) in the lte-rrc.cqi_Reporting_r14 field indicate poor channel quality. This can lead to network performance issues such as reduced data throughput, increased latency, higher packet loss rates, and possibly lower user experience due to degraded service quality."
"What does it mean when the diameter.EAP-Payload field in a packet capture file contains null values, and how might this affect network authentication processes?",Null values in the diameter.EAP-Payload field indicate that there is no EAP data present in the Diameter message. This can lead to authentication issues because the necessary credentials or challenge responses required for authentication are missing.
How would you differentiate between latency caused by network congestion versus routing inefficiencies based solely on ICMP.resptime data?,"Differentiating between latency from network congestion and routing inefficiencies using ICMP.resptime alone can be challenging. However, patterns in response times might provide clues: consistent high latencies across all traffic may suggest congestion, while erratic or location-specific delays could indicate routing issues. Additional tools like traceroute and monitoring during varying traffic loads would be necessary for a more definitive analysis."
How can you construct a tcpdump filter to detect LTE RRC messages with errors in the CSFB parameters request specifically for CDMA2000 r8?,"To construct a `tcpdump` filter that detects LTE RRC messages with errors in the CSFB parameters request for CDMA2000 r8, use the following command: `tcpdump -nn 'lte-rrc.csfbParametersRequestCDMA2000_r8 == ""error""'`. This will capture packets where the specified field indicates an error condition."
What steps should you take if analysis of the 'diameter.Cisco-DSCP' filter reveals frequent occurrences of packets marked with DSCP values less than 32 in a network designed for high-priority traffic?,"Steps include: reviewing and updating QoS policies to ensure proper DSCP markings, checking configuration on network devices (like routers or switches) that handle Diameter traffic, investigating any automated marking systems for errors, and monitoring the impact of changes. Additionally, collaborating with stakeholders to align on priority settings is crucial."
What are some possible reasons for a sudden increase in packets with 'gquic.prflags.entropy == true' during network monitoring?,"A sudden increase in packets with `gquic.prflags.entropy == true` could be due to several factors: deployment of new privacy-focused applications or features, changes in configuration settings that introduce more entropy for enhanced security, or a response to detected threats prompting increased obfuscation measures."
"In analyzing LTE traffic with interference measurement restrictions, how can high values (>50) of 'interferenceMeasRestriction_r13' impact network performance?","High values (>50) of 'interferenceMeasRestriction_r13' in LTE traffic indicate severe interference measurement limitations. This can impair the network's ability to dynamically adjust and optimize its parameters, leading to reduced data throughput, increased latency, and overall degraded Quality of Service (QoS)."
What does an icmpv6.ni.flag.s value of true signify about the address type being solicited in a Neighbor Solicitation message?,"An `icmpv6.ni.flag.s` value set to true signifies that the Neighbor Solicitation message is requesting information about a site-local IPv6 address. This flag indicates that the solicited node's address falls within a range intended for local network use, not globally routable addresses."
How would you construct a Wireshark filter to identify IPv6CP option length mismatches where the option length is less than 2?,"To identify IPv6CP option length mismatches with values less than 2 in Wireshark, use the following filter: `ipv6cp.opt.length < 2`. This filter will display packets where the IPv6CP option length is below the valid minimum threshold."
How would you construct a Wireshark filter to identify GSM RLC/MAC packets indicating potential handover issues due to low 3G notification reporting quantities?,"To construct a Wireshark filter for identifying GSM RLC/MAC packets with low 3G notification reporting quantities, use the following syntax: `gsm_rlcmac_dl.target_cell_3g_notif_reporting_quantity < 5`. This will display only those packets where the field value is less than 5, indicating potential handover issues."
"In diagnosing bit rate multiplier configuration problems, why is it important to monitor the lte-rrc.bitRateMultiplier_r16 field in LTE networks?","Monitoring the `lte-rrc.bitRateMultiplier_r16` field is crucial because it directly affects data throughput and network efficiency. Ensuring that this value is correctly configured helps maintain optimal performance, prevents underutilization of available bandwidth, and ensures a high-quality user experience by allowing devices to operate at their maximum potential speeds."
Explain how you would use packet capture tools to verify if null EAP payloads are being sent due to misconfigurations in RADIUS servers.,To verify this: 1) Capture traffic during a failed authentication attempt. 2) Apply the filter `diameter.EAP-Payload == 0x00`. 3) Identify relevant Diameter messages and check for expected EAP data presence. 4) Cross-reference with RADIUS server logs to identify configuration errors or missing settings causing null payloads.
What additional network parameters should be monitored alongside the mac-lte.control.dual-conn-power-headroom fields to fully assess the impact of no power headroom availability?,Additional parameters to monitor include: 1) Signal-to-noise ratio (SNR) and reference signal received power (RSRP). 2) Traffic load statistics on primary and secondary cells. 3) Latency and jitter metrics for data transmission. 4) Cell throughput and user equipment (UE) handover success rates.
What Wireshark filter would you use to capture packets where LTE RRC 'interFreqProximityIndication_r9' supports proximity indication?,"To capture packets where the LTE RRC 'interFreqProximityIndication_r9' field supports proximity indication, you can use the following Wireshark filter: `lte-rrc.interFreqProximityIndication_r9 > 0`. This filter will include all packets where the value is greater than 0, indicating that proximity indication is supported."
In what ways could a continuous stream of pSCell addition failures impact overall LTE network stability and performance?,"A continuous stream of `pSCellToAddMod` failures can compromise LTE network stability by preventing effective use of carrier aggregation, thus reducing available data throughput. This degradation in performance might lead to increased latency, reduced quality of service for users, and higher rates of connection drops or slowdowns across the network."
Explain how a misconfiguration in zone-based pool selection can impact LTE network performance.,"A misconfiguration in zone-based pool selection can lead to improper resource allocation across different zones, causing network inefficiencies. This might result in increased latency, higher packet loss rates, and an overall degradation of service quality due to the inability to dynamically allocate resources based on demand."
How could repeated occurrences of Diameter messages with IDR_flags_bit0 set to true be indicative of a larger network problem or attack vector?,"Repeated occurrences may indicate network congestion, faults in the signaling paths, or issues like DoS attacks where attackers flood the network with requests. Patterns such as synchronized requests from multiple sources or anomalies in request origins could suggest malicious activity."
Describe a scenario where monitoring P-CSCF Restoration Indications using the filter condition gtpv2.pcri == true could help diagnose an issue with VoLTE connectivity.,"A scenario might involve a network experiencing intermittent call drops or poor voice quality. By applying the `gtpv2.pcri == true` filter to packet captures, a technician can identify instances where P-CSCF restoration is triggered. Analyzing these events could reveal patterns, such as specific times of day when issues occur, helping diagnose whether the problem lies in network congestion during peak hours or configuration errors affecting the stability of VoLTE connections."
How would you use tcpdump to capture packets that indicate potential issues with PDCCH configurations for both SCell and SPS?,"To capture packets using `tcpdump` that might indicate issues with PDCCH configurations for both SCell and SPS, ensure the filter can identify RRC messages based on known LTE packet headers. Since tcpdump doesn't understand specific LTE fields directly without additional tools or libraries, capturing the relevant traffic would typically involve broader criteria such as port numbers associated with LTE signaling. For more precise capture, post-capture analysis in Wireshark is recommended."
How would you differentiate between a legitimate configuration where the 'http.authcitrix.domain' is intentionally left blank versus a misconfiguration?,"Differentiating between intentional and unintentional empty Citrix domains involves checking system documentation, configurations, or discussions with network administrators. If no domain is required by design, this will be documented; otherwise, the absence of domain information usually points to a misconfiguration."
"What network configuration or hardware problems could lead to all conditions (mac-lte.control.activation-deactivation.c28 to c31) being False, and how would you verify these issues?","Network configuration issues could include incorrect parameter settings, missing entries in the database for cell activation, or improper signaling configurations. Hardware problems might involve faulty antennas, base station failures, or synchronization hardware malfunctions. Verification involves checking configuration files against known correct settings, performing hardware diagnostics and tests, and analyzing logs for error indications."
"How would you construct a Wireshark filter to identify Diameter messages with unexpected 'Variable-Part-Type' values that are not in the set {1, 2, 3}?","To construct a Wireshark filter for identifying Diameter messages with unexpected 'Variable-Part-Type' values, use the following filter expression: `diameter and diameter.Variable-Part-Type not in {1, 2, 3}`. This will display only the packets where the 'Variable-Part-Type' is outside the expected set of values."
What are the implications of setting an RSRP validation threshold too high on handover performance in LTE networks?,"Setting an RSRP validation threshold too high can negatively impact handover performance by causing legitimate measurements to be discarded. This might lead to improper or delayed handovers, as devices may not have accurate information about the signal quality of neighboring cells, resulting in dropped calls and degraded service."
"What does the field 'lte-rrc.earlyData_UP_5GC_r16' indicate in the context of a 5G network's early data transmission, and why is it important for applications requiring low latency?","'lte-rrc.earlyData_UP_5GC_r16' indicates whether early data transmission has been enabled according to Release 16 of LTE RRC signaling standards in a 5G context. This feature allows user plane data to start being sent before the completion of the Radio Resource Control (RRC) connection setup, which is crucial for reducing latency and improving responsiveness, thereby benefiting applications that require low latency."
What troubleshooting steps should be taken after identifying packets where lte-rrc.sensingPeriodicity_r15 == 0 in an LTE network analysis?,"After identifying packets with `lte-rrc.sensingPeriodicity_r15 == 0`, the following steps should be taken: 1) Confirm if this configuration is intentional or erroneous. 2) If unintended, update the configuration to a valid periodicity value. 3) Monitor network performance post-adjustment to ensure efficient resource allocation and improved service quality."
"Given a scenario where APN Validity Time expiries are causing disruptions, how would you use packet analysis tools to identify and log these events over time?","To identify and log APN Validity Time expiries using packet analysis tools like Wireshark or tcpdump: 
1. Set up continuous capture on the relevant network interface.
2. Apply a filter for `diameter.APN-Validity-Time == 0` to isolate packets with expired validity times.
3. Use time-stamping features in these tools to log when each expiry event occurs.
4. Save captured data and logs for further analysis to identify patterns or frequency of expiries."
What does a packet capture showing an ftp.command-response.duration of over 5000ms indicate about network performance when executing FTP commands like 'RETR'?,"A packet capture indicating an `ftp.command-response.duration` of over 5000 milliseconds suggests that there is a significant delay in the server's response to the RETR command. This could imply issues such as network congestion, high server load, or misconfigurations affecting the speed and efficiency of FTP operations."
"What are potential issues or misconfigurations that could arise from having the PBIC flag set to false in GTPv2 traffic, and how might this affect overall network performance?","Having the PBIC flag set to false in GTPv2 traffic can lead to several potential issues or misconfigurations. Since BBAI information is not propagated when the flag is unset, there could be disruptions in seamless handovers between base stations, affecting user mobility and session continuity. This might result in dropped sessions or degraded service quality for mobile users. Additionally, it may cause inefficiencies in load balancing across the network as changes to Base Station Anchor IDs are not communicated effectively."
What additional information from other packet fields might help diagnose why the Citrix domain field appears empty?,"Additional diagnostic information can be gathered by examining fields such as 'User-Agent', 'Host' headers, source/destination IP addresses, and timestamps. These may provide context on client configurations or network behavior contributing to the issue."
What Wireshark filter syntax would you use to isolate packets indicating a wideband signal quality less than -9 dBm in an LTE Release 12 network?,"To isolate packets with `lte-rrc.q_QualMinWB_r12` values less than -9 dBm using Wireshark, the appropriate filter syntax is: `lte-rrc.q_QualMinWB_r12 < -9`. This filter will capture and display only those packets that meet this condition."
"In what scenarios might you encounter a gsm_rlcmac.ul.dtm_handover_capability value of 0, and how could this impact mobile user experience?","You might encounter a `gsm_rlcmac.ul.dtm_handover_capability` value of '0' in networks or devices that do not support DTM handovers. This can impact the mobile user experience by causing potential interruptions during network transitions (handovers), leading to dropped calls or loss of data connectivity."
Describe how the 'ipv6.src_addr_space' filter condition works in Wireshark when identifying non-routable addresses.,"The 'ipv6.src_addr_space' filter condition in Wireshark is used to categorize IPv6 addresses based on their scope, such as global, unique local (ULA), or link-local. By specifying this filter with conditions like `ipv6.src_addr_space == 'private'`, you can isolate packets originating from non-routable address spaces, which are not intended for use in public internet communications."
Describe the steps to troubleshoot issues arising from packets with empty 3GPP2-Charging-Rule-Definitions in a telecom network.,"To troubleshoot these issues: 
1. Capture traffic using Wireshark or tcpdump to identify packets with empty `3GPP2-Charging-Rule-Definition` fields.
2. Verify the configuration of your Diameter servers and check if they are correctly providing charging rule definitions.
3. Review logs on both the client and server sides for any errors related to charging rule provisioning.
4. Ensure that all updates or changes to charging rules have been properly synchronized across network elements."
"What does it indicate if the value of `gsm_rlcmac_dl.target_cell_gsm_arfcn` in captured GSM traffic does not match the expected ARFCN, and what might be some underlying causes for this discrepancy?","If the `gsm_rlcmac_dl.target_cell_gsm_arfcn` value does not match the expected ARFCN, it indicates a potential issue such as an unexpected cell handover or a configuration error in the network. Underlying causes could include incorrect network settings, issues with the Base Transceiver Station (BTS), or problems during the handover process."
Explain how you would use tcpdump to capture packets related to eCall services when the LTE RRC message indicates that IMS support is disabled.,"To capture packets with tcpdump where 'lte-rrc.eCallOverIMS_Support_r14' equals 0, you can specify a filter directly if your capture tool supports it. Assuming direct field access in the captured traffic: `tcpdump -i any 'lte-rrc.eCallOverIMS_Support_r14 == 0'`. Note that this requires custom parsing or an extended capture library to interpret LTE RRC messages."
"In a scenario where you are monitoring for encapsulation errors, how would you interpret packets that match both filter conditions simultaneously?","Packets matching both conditions ('ipv6.opt.tel > 255' and 'ipv6.opt.tel.invalid_len == 1') strongly indicate severe misconfigurations or software bugs affecting tunnel encapsulation. Such packets should be prioritized for detailed inspection to identify the root cause, whether it's a network device configuration error or an issue with the encapsulating protocol itself."
"What are the implications of frequent 'Unreassembled fragment' values for a network's reliability and throughput, and how could you mitigate these issues using routing or packet reassembly techniques?","Frequent 'Unreassembled fragment' values imply unreliable data transmission, reducing effective throughput and increasing latency. Mitigation strategies include: optimizing MTU settings across the network to minimize fragmentation, adjusting route paths to avoid bottlenecks, and configuring routers to handle larger packets if possible."
How can analyzing the 'lte-rrc.radioResourceConfigCommonPSCell_r12_element' field help in identifying and mitigating degraded network performance in LTE Release 12?,"Analyzing the 'lte-rrc.radioResourceConfigCommonPSCell_r12_element' field helps identify specific misconfigurations that contribute to degraded network performance. By pinpointing packets with this field marked as 'misconfigured', you can correlate these configurations with observed network issues, facilitating targeted troubleshooting and corrective measures to restore optimal network function."
What steps would you take after identifying Diameter messages with a service-specific type of 1 and an inactive status to ensure minimal impact on end-users?,"After identification, confirm the root cause by checking configurations, logs, and system health. Implement immediate fixes if possible (e.g., restart services or resolve configuration issues). Communicate transparently with affected users about any temporary disruptions while working on a permanent solution. Finally, document findings to prevent recurrence."
"Given that the lte-rrc.symbolBitmapFddDl_element field shows 'No Data', what steps can be taken to verify if this issue stems from user equipment (UE) or network-side configurations?","To determine whether the issue is UE-related or due to network configuration, analyze other related fields and messages. Check for RRC connection requests, reconfiguration attempts, and signaling logs from both directions. If only specific UEs are affected consistently, it may indicate a UE-specific problem; otherwise, broader network-side issues might be present."
"If a PCAP analysis reveals unreassembled fragments alongside retransmissions, how would you determine if this is indicative of a SYN flood attack or simply high network latency?","To differentiate between a SYN flood and high network latency: 1) Check for a large number of incomplete TCP connections in the SYN-ACK/ACK handshake. This suggests a SYN flood. 2) Analyze retransmission patterns; frequent retransmissions without successful ACKs might indicate congestion or packet loss, rather than a DoS attack."
What are the possible network implications if multiple packets with LAC values below 1000 are observed during a location update process?,"Multiple packets with LAC values below 1000 during a location update can lead to failed updates, resulting in users being incorrectly registered or not registered at all. This may cause service disruptions like inability to make/receive calls or send data. Persistent issues might indicate deeper network configuration problems."
How can analyzing the 'gsm_rlcmac.ul.prr_exist_32qam_hsr_mean_bep' and 'gsm_rlcmac.ul.prr_exist_32qam_nsr_mean_bep' fields help in diagnosing performance issues in a 32QAM modulated GSM network?,"Analyzing these fields helps identify where errors are occurring within the modulation scheme. High values indicate poor signal quality or interference, enabling pinpointing of problematic areas like specific cell sites or times of day. This information can guide corrective actions to enhance network reliability and performance."
Explain the significance of filtering packets where diameter.SN-Proxy-MIPv6 == 1. What kind of network events would you expect to analyze with such a filter?,"Filtering for `diameter.SN-Proxy-MIPv6 == 1` focuses on the first active session. This is significant for analyzing initial handoffs, verifying successful establishment of sessions, and checking if there are any issues during the initiation phase. It helps in understanding how quickly a mobile node can establish a connection after moving to a new network area."
What are the implications of having a diameter.3gpp.qos.qos.maximum_sdu_size value greater than 1500 on packet fragmentation and reassembly processes?,"A Maximum SDU Size greater than 1500 implies that packets may need to be fragmented into smaller units for transmission, as they exceed typical MTU sizes. This leads to additional processing for fragmenting and later reassembling at the destination, which can cause increased latency, higher risk of packet loss during transit, and potentially more complex error handling."
How can analyzing packets with incorrect BSIC values help in troubleshooting handover issues in GSM networks?,"Analyzing packets with incorrect BSIC values helps identify whether improper cell identification is causing handover failures. By pinpointing these discrepancies, network administrators can address misconfigurations or hardware faults that lead to unsuccessful handovers, improving overall network reliability and performance."
