Question,Answer
Explain how monitoring narrowband allocations using RRC messages can help in identifying inefficiencies or allocation issues within an LTE network.,"Monitoring narrowband allocations using RRC messages helps identify inefficiencies by revealing patterns in resource usage. High numbers of monitored narrowbands may indicate excessive signaling, misconfigurations, or imbalanced resource distribution. Analyzing these fields allows for the detection of potential congestion points and aids in optimizing resource management."
In what scenarios would filtering for True values across multiple MBMS parameter versions be crucial for network analysis?,"Filtering for True values across multiple MBMS parameter versions is crucial in scenarios where comprehensive feature sets or optimizations need to be verified. This includes analyzing the full spectrum of enhancements and functionalities available in newer protocol versions, ensuring that all relevant parameters are configured correctly for optimal MBMS service performance."
How can monitoring for malformed IP address lengths in Diameter protocol aid in troubleshooting connectivity issues?,"Monitoring for malformed IP address lengths allows administrators to quickly identify and rectify configuration errors, software bugs, or potential security threats that might disrupt network operations. By detecting these anomalies early, corrective actions can be taken to prevent broader connectivity problems, ensuring stable and secure network performance."
What potential network issues could be indicated by multiple packets with 'http2.altsvc.port == 0' and 'http2.altsvc.protocol == '' in a captured PCAP file?,"Multiple packets showing `http2.altsvc.port == 0` and `http2.altsvc.protocol == ''` could indicate widespread misconfiguration or lack of proper fallback mechanisms. This might lead to service interruptions if the primary HTTP/2 services become unreachable, highlighting reliability concerns."
Explain how misconfigured LAC values might impact network performance and user experience.,"Misconfigured `LAC` values can lead to inefficient routing of calls and data sessions, increased latency, dropped connections, and poor handover performance between cells. Users may experience frequent call drops, reduced signal quality, slower data rates, and an overall degraded mobile experience."
"What does it imply if lte-rrc.prach_ConfigIndex_r15 has a value of 0 in an LTE network, and how might this affect user equipment (UE) access to the network?","If `lte-rrc.prach_ConfigIndex_r15` has a value of 0, it indicates that the default PRACH configuration index is being used. This can imply a lack of proper configuration for the Physical Random Access Channel (PRACH), which may lead to access issues for User Equipment (UE). The UE might experience difficulties in performing the random access procedure necessary to establish communication with the network."
How could you modify your PCAP filter to include both LTE RRC feMBMS Unicast Parameters set to 'default' and any instances where these parameters are explicitly defined with non-default values?,"To capture both default and non-default unicast parameter settings, use the following combined Wireshark filter: `lte-rrc.feMBMS_Unicast_Parameters_r14_element == 'default' || lte-rrc.feMBMS_Unicast_Parameters_r14_element != 'default'`. This expression ensures that all instances of this field are included in the capture."
Describe how you would use tcpdump to capture packets that show an active MPS for DTS feature in Diameter protocol communication.,"To capture packets with tcpdump showing an active MPS for DTS feature, you can run the following command: `tcpdump -i any proto diameter and 'diameter.3gpp.feature_list2_rx_flags_bit14 == true'`. This captures all Diameter traffic where the Feature List 2 Rx Flags Bit 14 is set to indicate the MPS for DTS feature is active."
How can you differentiate between transient errors and persistent misconfigurations in diameter.To-SIP-Header using PCAP analysis tools?,"To differentiate between transient errors and persistent misconfigurations, analyze the frequency and consistency of 'error' occurrences. Transient errors may appear sporadically or under specific conditions (e.g., network congestion), while persistent misconfigurations will consistently produce errors across multiple packets and sessions."
What additional information or packet fields might you analyze alongside lte-rrc.p0_NominalPUSCH_r10 and lte-rrc.p0_NominalPUSCH_SubframeSet2_r12 to better understand uplink power control issues in LTE?,"Additional fields to analyze include: 1. `lte-rrc.ul_ReferenceSignalsPower` for understanding reference signal transmission power levels. 2. `lte-rrc.pMax` which indicates the maximum allowed transmit power, helping verify if values are within configured limits. 3. `lte-rrc.ue_RxTxTimeDiff` to assess timing synchronization issues. 4. Packet retransmission counters and error rates that may provide insights into uplink performance issues."
Explain why a network engineer might look for packets with 'lte-rrc.srsSubframeConfiguration == 0' when troubleshooting SRS configuration issues.,"A network engineer might look for packets with 'lte-rrc.srsSubframeConfiguration == 0' to verify that the subframe configuration is set to its default. This can help determine if there are deviations from expected configurations, which may contribute to issues in how Sounding Reference Signals (SRS) are being processed or utilized within the network."
Describe the steps you would take to troubleshoot TMGI deallocation failures using PCAP analysis with Wireshark or tcpdump.,"To troubleshoot TMGI deallocation failures: 
1. Capture network traffic using tools like Wireshark or tcpdump. 
2. Apply the filter `diameter.3gpp.tmgi_deallocation_result_bit2 == true` to isolate relevant packets indicating deallocation failures. 
3. Analyze these packets for patterns, such as frequency and timing of failures. 
4. Examine related Diameter protocol fields for additional context (e.g., error codes or session identifiers). 
5. Correlate findings with network logs or application behavior to identify potential causes."
Describe a method to identify whether a specific device in your network supports or rejects packets with 'ipv6.opt.experimental == 1'.,"To determine if a device supports `ipv6.opt.experimental == 1`, send test packets containing experimental options to the device and monitor its response. If it processes and responds correctly, it supports the option; otherwise, observe for packet loss or error responses indicating rejection."
How would you construct a Wireshark filter to identify packets where the LTE RRC explicitListOfARFCNs field is set to 0?,"To construct a Wireshark filter for identifying packets where the LTE RRC `explicitListOfARFCNs` field is set to 0, you can use the following syntax: `lte-rrc.explicitListOfARFCNs == 0`. This filter specifically targets and displays packets in which this condition is met."
Describe how poor target_cell_3g_notif_reporting_quantity values might impact network stability and user experience in a GSM RLC/MAC environment.,"Poor `target_cell_3g_notif_reporting_quantity` values can lead to inaccurate cell information being used for handovers or cell selection, resulting in dropped calls, reduced data throughput, increased latency, and generally poor network performance. This affects user experience by causing frequent call drops, slow internet speeds, and overall service unreliability."
What additional information would be useful to gather from a PCAP file when troubleshooting Diameter address resolution failures?,"Useful information includes: timestamps of failed transactions, sequence numbers for identifying related packets, source and destination IP addresses, logs of any error messages or alerts, protocol-specific headers that could indicate configuration issues, and details on network interfaces involved in the communication."
"If 'lte-rrc.sc_MTCH_InfoList_MultiTB_r16' values are consistently above 10, what steps would you take to diagnose the underlying issue?","To diagnose the underlying issue when 'lte-rrc.sc_MTCH_InfoList_MultiTB_r16' values are consistently above 10, review network configuration settings for correctness, analyze traffic patterns over time, and examine resource allocation. Consultation with network management tools and logs would also be beneficial."
"In analyzing PCAP files, how would you identify packets that indicate potential compatibility issues due to unsupported GERAN feature packages? What steps would you take after identifying these packets?","To identify packets indicating compatibility issues due to unsupported GERAN feature packages, use a filter like `gsm_rlcmac_ul.geran_feature_package_1 == 0`. After identifying these packets, review their frequency and context in the capture to determine if they correlate with specific network events or performance degradation. Further investigation may involve checking device configurations or consulting network documentation for necessary upgrades."
"What does the field value of 0 for 'lte-rrc.noResourceRestrictionForTTIBundling_r12' indicate in terms of LTE network performance, particularly for latency-sensitive applications?",A field value of 0 for 'lte-rrc.noResourceRestrictionForTTIBundling_r12' indicates that there are resource restrictions for TTI bundling. This can negatively impact the performance of latency-sensitive applications because it may lead to increased processing delays and reduced efficiency in handling time-critical data packets.
"How would you construct a Wireshark filter to capture Diameter messages that do not conform to the E.164 address format, specifically those not starting with '+'?","To capture Diameter messages where 'diameter.Framed-IP-Address.E164' does not start with '+', use the Wireshark display filter: `diameter && !(diameter.Framed-IP-Address.E164 starts_with ""+"")`. This filter selects Diameter protocol packets and excludes those where the E.164 address begins correctly."
How can analyzing packets with diameter.3gpp.tmgi_deallocation_result_bit2 set to true help in identifying the root cause of multicast service disruptions?,"Analyzing packets where `diameter.3gpp.tmgi_deallocation_result_bit2` is set to true helps identify the root cause of multicast service disruptions by: 
- Providing insights into specific deallocation failure instances and their context within network traffic. 
- Allowing correlation with error codes or session identifiers to pinpoint configuration issues, resource constraints, or protocol mismatches.
- Enabling tracking of patterns over time that may indicate systematic problems affecting multicast services."
Describe the potential network problems that can arise from using higher GMSK power classes in GSM uplink communications.,"Using higher GMSK power classes in GSM uplink communications can lead to several network issues, including device incompatibility, where some devices cannot handle or process these signals, resulting in dropped connections. Additionally, it may cause interference with other transmissions, increasing the likelihood of errors and reduced overall network performance."
"In terms of troubleshooting an LTE network, how could you use packet captures to determine if there are issues related to power control or resource allocation by examining the PHR configuration?","Packet captures can be used to verify if devices are configured with `lte-rrc.mAC_MainConfig.phr_Config.setup_element == True`. If PHR is not enabled, it might suggest potential underutilization of device capabilities leading to inefficient power control and resource allocation. Analyzing these configurations could reveal misconfigurations or policy issues affecting network performance."
What potential issues could arise in a mobile network if the `gtp.ggsn_back_off_timer` is frequently set to values greater than 30 seconds?,"Frequent settings of `gtp.ggsn_back_off_timer` to values greater than 30 seconds may lead to increased latency and reduced throughput, potentially causing poor user experience and signaling congestion in the network."
What troubleshooting steps could be taken if an LTE network shows abnormal behavior and PDSCH ConfigCommon is not set to 'default'?,"First, identify all configurations that deviate from 'default'. Verify whether these deviations align with the observed issues. Reconfigure affected parameters back to 'default', test the network's performance again, and compare against baseline metrics. If issues persist, further analyze other potential causes."
"Given the filter condition 'lte-rrc.backhaulDL_BandwidthRequestWLAN_r13 > 1000000', describe how you would use tcpdump to capture relevant packets and analyze potential congestion issues.","To use tcpdump for capturing relevant packets based on the filter condition, first ensure that you are capturing traffic on the appropriate interface. Then apply a display filter or post-capture filtering using Wireshark since tcpdump does not support protocol-specific field filters directly. Capture with: `tcpdump -i <interface> -w capture.pcap`. Afterward, load 'capture.pcap' into Wireshark and apply the filter `lte-rrc.backhaulDL_BandwidthRequestWLAN_r13 > 1000000` to analyze potential congestion issues."
What are some troubleshooting techniques you might employ if you identify that dual carrier for DTM is not supported across multiple sessions in your network analysis?,"If dual carrier support is absent across multiple sessions, consider: 1) Checking device configurations to ensure they support and enable dual carrier modes. 2) Verifying network policy settings related to DTM and carrier usage. 3) Analyzing traffic patterns for congestion or interference issues. 4) Consulting vendor documentation for any known limitations or required updates."
"In the context of analyzing high downlink data usage, how can packet fields such as 'gtpv2.secondary_rat_usage_data_report.usage_data_dl' help in identifying anomalies or trends?","'gtpv2.secondary_rat_usage_data_report.usage_data_dl' helps identify anomalies by highlighting unusual spikes in data consumption that deviate from typical patterns. It assists in trend analysis by tracking usage over time, revealing consistent high-usage periods or devices that might need further investigation for either optimization opportunities or potential security concerns."
"What are potential causes for a GSM400 arc configuration error indicated by a value of '0', and how might these be reflected in packet captures?","Potential causes for a `gsm_rlcmac.ul.ms_class3_unpacked_gsm400_arc == 0` configuration error include incorrect network device configurations, software bugs, or improper provisioning. In packet captures, this would appear as packets with the specified field set to '0', potentially alongside repeated attempts to establish connections that fail due to lack of proper arc setup."
"If you were tasked with optimizing a GPRS network and identified several devices with 'gsm_rlcmac_ul.gprs_extended_dynamic_allocation_capability == 0', what strategies might you employ to mitigate potential inefficiencies?","To mitigate inefficiencies, consider strategies such as segmenting the network to isolate devices without extended dynamic allocation capabilities or upgrading these devices to support better resource management. Implementing Quality of Service (QoS) policies can also help prioritize traffic and improve overall network efficiency."
"In the context of LTE networks, what does an 'lte-rrc.ss_CCH_InterfHandl_r11' field value greater than 100 signify about the network's control channel conditions?","An 'lte-rrc.ss_CCH_InterfHandl_r11' field value greater than 100 signifies that there are high interference levels detected on the LTE Common Control Channel (CCH). This condition may indicate potential issues with signal quality or congestion, necessitating a review and possible optimization of control channel parameters to ensure efficient communication."
"What could be the impact on network performance if 'Override-Offline' values are incorrectly set as negative, and how would you mitigate such issues using PCAP analysis?","Incorrect 'Override-Offline' settings may lead to improper session handling, affecting authentication and authorization services. This can cause service disruptions or degraded performance. Mitigation involves capturing relevant traffic with Wireshark to identify anomalies, followed by configuration reviews and corrective actions based on the insights gained from packet data."
"In the context of LTE networks, explain how repeated 'lte-rrc.connEstFailReportReq_r11' messages might point to specific configuration issues.","Repeated occurrences of 'lte-rrc.connEstFailReportReq_r11' messages suggest consistent problems with establishing connections. This could indicate configuration issues such as incorrect network settings, improper cell setup procedures, or resource allocation conflicts. Analyzing the context and patterns of these failures can help pinpoint specific misconfigurations needing correction."
What are some potential reasons behind a `gsm_rlcmac.dl.tfi` value of 0 in GSM RLC/MAC protocols?,"Potential reasons include incorrect or default configuration settings, software bugs within the base station's firmware, or failures in initializing the traffic flow management system. These can prevent proper assignment and tracking of data flows, leading to communication disruptions."
"What does the field value b'\x00\x00\x00\x00' signify when analyzing Diameter Default-Quota messages, and what implications might it have for service delivery?","The field value `b'\x00\x00\x00\x00'` in Diameter Default-Quota messages signifies that no default quota is allocated. This can lead to service denial because the system may not allocate any resources, resulting in potential failure to deliver services as expected."
What does an 'lte-rrc.ac_BarringTime' value of greater than 60 seconds indicate in terms of network access for users?,"An 'lte-rrc.ac_BarringTime' value greater than 60 seconds indicates that the network is barring access for a prolonged period, potentially preventing users from accessing the LTE network for more than 60 seconds."
"In the context of LTE networks, what specific field values would indicate that PUSCH frequency hopping is disabled, and where can these fields typically be found within the LTE RRC protocol?","The specific field value indicating that PUSCH frequency hopping is disabled is `lte-rrc.pur_PUSCH_FreqHopping_r16 == false`. This field can be found in the LTE RRC (Radio Resource Control) protocol messages, specifically those related to uplink configuration and resource management."
Describe a method to differentiate between missing reports due to UE errors versus potential configuration issues in the network equipment using packet analysis.,"To differentiate between UE errors and network configuration issues, analyze packet captures for consistency across multiple UEs and time periods. If only specific UEs are affected, it's likely an issue with those devices or their configurations. However, if all UEs in a particular area or on the same eNodeB exhibit missing reports, this suggests a network equipment configuration problem. Cross-referencing logs from both UE and network infrastructure can provide additional insights."
"What implications could arise from detecting non-zero values in the 'supported_message_types.reserved' field when analyzing Bluetooth traffic, and how would this affect protocol compliance?","Detecting non-zero values in the 'supported_message_types.reserved' field suggests that there are deviations from the expected protocol usage. This can result in non-compliance with Bluetooth standards, potentially causing interoperability issues between devices, unexpected behavior during communication, or security vulnerabilities due to improper implementation."
"In what scenarios might an 'establishmentCause' of 3 be triggered, and how can this information guide network optimization strategies?",'EstablishmentCause' of 3 may be triggered during high traffic periods or when resource allocation policies fail to prioritize critical connections. This information can guide network optimization by highlighting the need for improved priority management and resource scheduling algorithms.
"How can the identification of Diameter messages with specific conditions, such as diameter.Service-Specific-Type == 1 and diameter.Service-Status == 'inactive', aid in proactive network management?","Identifying these messages allows network managers to monitor service health proactively. By detecting inactive services early, they can address issues before they affect end-users significantly. This proactive approach helps maintain high service availability and reliability."
How would you construct a Wireshark filter to identify packets where the lte-rrc.semiPersistSchedIntervalSL_r14 field is set to zero?,"To construct a Wireshark filter for identifying packets with the `lte-rrc.semiPersistSchedIntervalSL_r14` field set to zero, you would use the following filter expression: `lte-rrc.semiPersistSchedIntervalSL_r14 == 0`. This filter will display all packets where this specific RRC message field has a value of zero."
"In analyzing a PCAP file for Bluetooth communication issues, why is it important to check for packets with an empty 'btsdp.protocol' field?","Checking for packets with an empty 'btsdp.protocol' field in a PCAP file analysis is important because such entries indicate missing protocol definitions necessary for proper service identification and operation. This can lead to communication failures or unexpected behavior in Bluetooth services, affecting both functionality and network performance."
How would you construct a Wireshark filter to capture only those packets where the LTE RRC obtainLocationConfig_r11 message indicates that location configuration is active?,"To capture packets indicating that the location configuration is active, you can use a Wireshark display filter: `lte-rrc.obtainLocationConfig_r11 == 'enabled'`. This filter specifically targets packets with the `lte-rrc.obtainLocationConfig_r11` message set to 'enabled'."
"If you are debugging a scenario with frequent RRC Connection Setup failures, which specific field values in the packet capture would help confirm that 'ConnectionRequest' messages are being sent but not acknowledged?","To confirm that 'ConnectionRequest' messages are being sent but not acknowledged, look for packets where `lte-rrc.DL_CCCH_Message == 'ConnectionRequest'` and check if subsequent responses have the field `lte-rrc.dL_CCCH_Message.message == 0`. This indicates no acknowledgment was received following a connection request."
"In analyzing a PCAP file with the filter '_ws.unreassembled.expert == 'Unreassembled fragment'', how could you differentiate between packet loss and fragmentation issues based on other fields such as TTL or sequence numbers?","To differentiate between packet loss and fragmentation issues: Check for missing fragments by examining IP Fragment Offset and Identification fields. If offsets are missing, it suggests packet loss. For fragmentation issues, look at the 'More Fragments' flag; if set but subsequent packets are absent, reassembly failure is likely. TTL values alone don't distinguish these issues directly."
What potential impact on network latency and user experience could arise from parameters being consistently flagged as 'high' in the lte-rrc.parametersAboveThres_r14_element and lte-rrc.parametersAboveThres_v1530_element fields? Provide examples.,"Consistently high values can lead to increased network latency due to congestion, causing slower data transmission. Users might experience delays in web page loading, buffering during video streaming, or lag in online gaming. Call quality could degrade with dropped calls or poor voice clarity. Additionally, mobile devices may frequently attempt reconnections or handovers, further impacting user experience."
Describe a scenario where 'lte-rrc.fembms_MixedCarrier_r14 == false' could lead to degraded network performance. What steps would you take to diagnose the root cause using PCAP analysis?,"A scenario might involve users experiencing poor video streaming quality or failure to receive broadcast content, as multicast services are unavailable. To diagnose, use a PCAP file to filter by `lte-rrc.fembms_MixedCarrier_r14 == false`. Investigate surrounding LTE RRC messages for errors or misconfigurations, check for repeated attempts to access eMBMS resources, and look at network congestion indicators in IP/UDP headers."
What does an ICMPv6 packet with 'icmpv6.type' set to 128 and 'icmpv6.undecoded.type' different from 128 signify in terms of network communication?,"An ICMPv6 packet with `icmpv6.type` set to 128 (Echo Request) but having a different value for `icmpv6.undecoded.type` signifies a type mismatch or decoding error. This discrepancy indicates that the packet was expected to be an Echo Request, but something went wrong during its interpretation, possibly due to misconfiguration or software issues."
How would you construct a Wireshark filter to identify all Diameter packets where the MIP-Home-Agent-Address is set to an IPv4 address of 0.0.0.0?,"To construct a Wireshark filter for identifying Diameter packets with MIP-Home-Agent-Address set to 0.0.0.0, you can use: `diameter.MIP-Home-Agent-Address.IPv4 == 0.0.0.0`. This filter specifically targets the MIP-Home-Agent-Address field in Diameter protocol messages and checks if it equals 0.0.0.0."
