Question,Answer
Describe a method using tcpdump to capture only those packets where the Diameter protocol indicates a service-specific type of 1 and an inactive status.,"Using tcpdump, you can apply filters to capture relevant packets by first filtering for Diameter protocol traffic: `tcpdump -i any 'port 3868 or port 3386'`. However, capturing specific fields like diameter.Service-Specific-Type and diameter.Service-Status requires post-capture analysis with tools like Wireshark as tcpdump does not natively support complex protocol field filters."
"What specific steps would you take to troubleshoot an LTE network issue if you suspect that misconfigured default values are being used, based on PCAP analysis?","To troubleshoot, first capture packets using tcpdump or Wireshark during the period of performance issues. Apply filters `lte-rrc.defaultValue == 'default'` and `lte-rrc.defaultValue_element == 'default'`. Analyze these packets to identify specific default configurations in use. Review network conditions that might require custom settings and adjust parameters accordingly, testing for improvements."
What are the implications of detecting invalid timeslot numbers (greater than 7) in a GSM network using PCAP analysis?,"Detecting invalid timeslot numbers greater than 7 through PCAP analysis implies potential issues with the network's configuration or software. It could lead to service disruptions, degraded performance, and difficulties in maintaining proper communication channels within the GSM network. Such anomalies need immediate investigation to prevent broader network problems."
"In what situations might a reset of the PMO index occur, and how would you detect this using PCAP analysis tools?","A reset of the PMO index might occur during events such as network handovers, system reboots, or software resets. You can detect these resets by analyzing packet captures with the filter `gsm_rlcmac.dl.pmo_index == 0` and observing transitions from non-zero values to zero, indicating a reset."
"In a scenario where LAC values are frequently below 1000, how would you differentiate between configuration errors and intentional network testing or attacks?",Differentiating requires analyzing the context and frequency of invalid LAC occurrences. Configuration errors often result in random or widespread anomalies across devices. Intentional testing usually follows specific patterns or times. Investigate logs for unauthorized access attempts to identify potential security breaches.
How would you construct a Wireshark filter to identify instances where 'lte-rrc.offsetCE_ModeB_r15' indicates potential performance issues at the cell edge in LTE networks?,"To construct a Wireshark filter for identifying instances of poor cell edge performance, you can use: `lte-rrc.offsetCE_ModeB_r15 < -10`. This will capture packets where this field value is less than -10, indicating significant negative offsets."
What does a non-zero value in the 'btsdp.map.mas.supported_message_types.reserved' field indicate about the usage of reserved message types in a Bluetooth network?,"A non-zero value in the 'btsdp.map.mas.supported_message_types.reserved' field indicates that reserved message types are being used, which should not occur under normal circumstances. This suggests potential protocol misuse or an error within the Bluetooth network communication."
Explain how a value of <-100 for lte-rrc.thresholdUTRA_RSCP might affect user experience on an LTE network.,"A `lte-rrc.thresholdUTRA_RSCP` value less than -100 indicates poor signal strength. This can lead to dropped connections, increased latency, and reduced data throughput, negatively affecting the user's ability to make calls, browse the internet, or use mobile applications efficiently."
"What is the significance of the lte-rrc.earlySecurityReactivation_r16 field in LTE networks, and how does its value affect initial connection setup?","The `lte-rrc.earlySecurityReactivation_r16` field indicates whether early security reactivation is enabled (value '1') during the initial connection setup of an LTE network. Its significance lies in ensuring that secure communication channels are established quickly and securely from the onset, protecting against potential threats during the critical phase of establishing a radio resource control (RRC) connection."
How can analyzing packets with `gtpv2.ext_tra_info_loi.ggsn.gn == False` help in troubleshooting GTPv2 connectivity issues?,"Analyzing packets with `gtpv2.ext_tra_info_loi.ggsn.gn == False` helps identify instances where the Gn interface is inactive. This can reveal potential misconfigurations, network disruptions, or performance issues affecting the GTPv2 connectivity."
"What are some common causes for 'lte-rrc.NAS_DedicatedInformation' being set to 0, and what diagnostic tools or methods would you use to verify these causes?","'lte-rrc.NAS_DedicatedInformation' set to 0 can be caused by packet corruption, misconfigurations, or software bugs. Diagnostic tools include using PCAP analysis with Wireshark filters, network simulators for testing configurations, and monitoring logs from LTE base stations."
In what scenarios might a network operator need to investigate the conditions where gsm_rlcmac_dl.pho_uplinkassignment_usf_singleallocation > 63 and gsm_rlcmac_dl.pho_usf == 0 in GSM networks?,"A network operator would need to investigate these conditions when there are reports of degraded service quality, such as poor call performance or high latency. They might also explore this during routine audits or after software updates if anomalies are detected that could affect resource scheduling and allocation within the network."
Describe a scenario where enabling uplink data split via SCG (lte-rrc.ul_DataSplitDRB_ViaSCG_r12 == True) could improve network performance.,"In a high-density urban area with multiple eNBs, enabling uplink data split via SCG can distribute the traffic load across several cells. This reduces congestion on any single cell, leading to improved data throughput and reduced latency for users connected to dual connectivity."
Explain the significance of the 'gtp.timezone_dst' field in the context of network time synchronization issues. How can this field be used for troubleshooting?,"The 'gtp.timezone_dst' field indicates whether DST is applied to GTP packets, which affects accurate timestamping and scheduling within the network. For troubleshooting, administrators can use a filter `gtp.timezone_dst != 0` in PCAP tools like Wireshark to detect packets with unexpected DST settings that could cause synchronization issues."
"Describe how you would use tcpdump alongside Wireshark to monitor GSM packets that exhibit a high power profile, focusing on filter construction and data capture strategies.",To monitor GSM packets with high power profiles using `tcpdump` and Wireshark: 1) Use `tcpdump` with a filter similar to the one used in Wireshark: `gsm_rlcmac.ul.ms_class3_unpacked_gmsk_multislot_power_profile > 10`. Example command: `tcpdump -i any -w capture.pcap 'gsm_rlcmac.ul.ms_class3_unpacked_gmsk_multislot_power_profile > 10'`. 2) Load the captured `.pcap` file into Wireshark for detailed analysis. Ensure that both tools are configured to capture relevant GSM traffic by specifying correct interface and filter criteria.
What strategies can network engineers employ to prevent the occurrence of 'gtpv2.tra_info_lne_rnc == 0' in their networks?,"To prevent 'gtpv2.tra_info_lne_rnc == 0', network engineers should ensure accurate RNC configuration and consistent updates, maintain robust connectivity checks between GTP entities, regularly audit GTP-C signaling processes for errors, implement redundancy plans to handle failures gracefully, and use monitoring tools to detect anomalies early."
Describe the potential implications on network performance if lte-rrc.mbms_Parameters_v1610_element is configured as True within an LTE environment.,"Configuring `lte-rrc.mbms_Parameters_v1610_element` to True suggests that enhancements specific to version 1610 are in use. This might have implications on network performance by enabling advanced features or optimizations, potentially improving service delivery efficiency and reducing latency or resource consumption for MBMS services."
"Explain how limited TTI combinations, as indicated by the sTTI_SupportedCombinations_r15_element field set to 'Limited', can affect throughput and latency in an LTE network.","'Limited' TTI combinations restrict the scheduling flexibility of transmissions. This constraint may result in suboptimal use of available bandwidth, leading to reduced data rates (throughput) and increased time delays between packet transmissions (latency), thus impacting overall user experience."
What indicators within the captured packets might suggest that there is congestion affecting UDP traffic on port 1812 in a Diameter 3GPP network?,"Indicators of congestion affecting UDP traffic on port 1812 include high packet loss rates, frequent retransmissions, increased latency between request and response packets, jitter (variability in packet delay), and large variations in inter-arrival times. Observing these patterns can suggest that the network is experiencing congestion issues."
Explain the significance of detecting undefined XML elements within Diameter messages for maintaining the integrity of network communication.,"Detecting undefined XML elements is crucial for maintaining network communication integrity because these elements can lead to message parsing failures, causing interruptions or malfunctions in network services. Identifying such issues ensures that all Diameter messages conform to protocol specifications, thereby preventing potential service disruptions and ensuring reliable communication."
Explain how an unknown IPv6CP option type might affect a device's ability to process IPv6 configuration messages correctly.,"An unknown IPv6CP option type may cause a device to ignore the corresponding configuration message or misinterpret it, leading to incorrect or failed IPv6 address configurations. This can result in connectivity issues as devices fail to properly configure their network parameters."
What Wireshark filter would you construct to identify LTE RRC Connection Release events where both 'poolToReleaseList_r13' and 'poolToReleaseListExt_r13' fields have values greater than zero?,"To identify LTE RRC Connection Release events where both 'lte-rrc.poolToReleaseList_r13' and 'lte-rrc.poolToReleaseListExt_r13' fields have values greater than zero, you would use the following Wireshark filter: `lte-rrc.poolToReleaseList_r13 > 0 && lte-rrc.poolToReleaseListExt_r13 > 0`. This filter ensures that only packets with both conditions met are displayed."
What does an empty 'http.authcitrix.domain' field indicate about the configuration in a Citrix network environment?,"An empty 'http.authcitrix.domain' field indicates a misconfiguration within the Citrix network setup, which can lead to authentication issues as the domain information necessary for validating user credentials is missing."
"In a scenario where you observe multiple GSM RLC/MAC downlink packets with N32 values under 10, what potential issues could this indicate about the network configuration or behavior?","Observing multiple GSM RLC/MAC downlink packets with N32 values under 10 may suggest potential misconfiguration in the network settings. It might indicate that the number of allowed retransmissions is set too low, which can lead to an increase in packet loss and degraded data transmission reliability due to insufficient retry opportunities."
"What does the 'diameter.Slg-Location-Type' field indicate when its value is set to 2, and why might this be significant for location-based services?","The 'diameter.Slg-Location-Type' field indicates the type of location request being made. When its value is set to 2, it signifies an emergency services location request. This is significant because such requests are critical in emergencies where precise and timely location information is necessary for providing appropriate assistance."
Explain how you would construct a Wireshark or tcpdump filter to identify all packets with a payload type value of 0 in GSM RLC/MAC uplink traffic.,"In Wireshark, you can use the display filter `gsm_rlcmac_ul.pemr_payloadtype == 0` directly. For tcpdump, which does not natively support dissectors for GSM protocols like Wireshark does, such filtering would typically require post-capture processing with tools that interpret the captured data structures. However, if you have a custom dissecting tool or script capable of interpreting these fields, it could be used to filter packets after capture."
How would you differentiate between normal and abnormal occurrences of low symbol allocation (lte-rrc.spdcch_NoOfSymbols_r15 < 2) in SPDCCH messages using PCAP analysis?,"To differentiate, analyze the frequency and context of occurrences. Normal instances might be infrequent and predictable during peak usage times or specific events. Abnormal occurrences are frequent, widespread, or coincide with network issues like increased error rates or degraded performance. Correlate these findings with traffic patterns and other metrics to assess abnormality."
How would you construct a Wireshark filter to identify all RRC messages that do not support any UTRA TDD 384 bands?,"To identify all RRC messages that do not support any UTRA TDD 384 bands in Wireshark, use the filter: `lte-rrc.supportedUTRA_TDD384BandList_item == 'unsupported'`. This filter checks for entries marked as 'unsupported', indicating those specific UTRA TDD 384 bands are not supported."
Describe a scenario where having both RLM Report Configuration (rlm_ReportConfig_r14) and RLM Report Support (rlm_ReportSupport_r14) fields set to zero could lead to difficulties in troubleshooting network issues.,"Consider a scenario where users experience intermittent connectivity or poor signal quality. If both `rlm_ReportConfig_r14` and `rlm_ReportSupport_r14` are set to 0, RRM reports that provide data on radio conditions won't be available. This lack of information makes it challenging to diagnose issues such as interference, coverage gaps, or hardware malfunctions, leading to prolonged troubleshooting times and unresolved network performance problems."
What does an empty string value for the diameter.Header-Insert-Definition field indicate in a Diameter protocol analysis?,"An empty string value for the diameter.Header-Insert-Definition field indicates that there is a missing header insert definition. This can lead to incomplete message headers, which may result in improper processing of Diameter messages."
Explain the significance of monitoring the 'lte-rrc.aggressorband1_r18' field in PCAP files for maintaining optimal LTE network performance.,"Monitoring the 'lte-rrc.aggressorband1_r18' field is significant as it helps detect and quantify interference from aggressor bands. By identifying when this value is greater than zero, network engineers can pinpoint sources of interference that degrade performance, allowing them to take corrective actions such as frequency adjustments or coordination with other spectrum users."
"Explain how you would use the value ranges of nB, nB_r13, and nB_r17 fields to identify potential anomalies or inefficiencies during the LTE RRC connection setup phase.","By examining the `nB`, `nB_r13`, and `nB_r17` field values in packet captures, you can identify anomalies or inefficiencies by noting patterns such as consistently low nB values (<10) across multiple connection attempts. High retransmission counts (elevated nB values) may indicate persistent issues like interference or misconfigurations. Comparing these fields for core versus extension messages helps pinpoint whether the problem lies with standard RRC operations or specific features added in later releases."
What are some potential consequences of encountering an 'application/json' content type in Diameter messages when another content type was expected? How might these mismatches affect application functionality or network performance?,"Encountering an 'application/json' content type in Diameter messages when another is expected can lead to several issues, such as the receiving application failing to parse the message correctly, resulting in errors or service disruptions. This mismatch could cause data integrity problems and potentially degrade network performance due to increased error handling overhead and retransmissions."
"How would you modify the existing filters if you needed to capture packets where lte-rrc.measResultCellListSFTD_r15 values are between 50 and 100, and what might this range indicate?","To capture packets where `lte-rrc.measResultCellListSFTD_r15` values are between 50 and 100, modify the filter to: `lte-rrc.measResultCellListSFTD_r15 >= 50 && lte-rrc.measResultCellListSFTD_r15 <= 100`. This range might indicate moderate signal strength from neighboring cells which is stronger than typical background noise but not excessively high, possibly suggesting normal fluctuations or mild interference."
Describe how you would use tcpdump to capture only those packets that contain a deprecated site-local address 'fec0::' in their ICMPv6 Neighbor Solicitation options.,"To capture these specific packets with tcpdump, use the following command: `tcpdump -i any icmp6 and icmp6[50] == 135 and icmp6[74:4] = \x20\xfe\xc0\x00`. This filter captures ICMPv6 packets where the Neighbor Solicitation type (located at offset 50) is 135, and it checks for a global address option containing 'fec0::' by verifying the bytes corresponding to this prefix."
"In a scenario where you are tasked with troubleshooting delayed event detections in an LTE network, how would filtering for lte-rrc.loggingInterval_r10 > 60000 help in identifying potential issues?","Filtering for `lte-rrc.loggingInterval_r10 > 60000` helps identify configurations where the logging interval is set too long. This can pinpoint a potential cause for delayed event detections, allowing network administrators to adjust the interval settings to improve real-time monitoring and responsiveness."
"Given a scenario where both email and MMS are unsupported, how would you interpret these findings in the context of device compatibility with modern messaging applications?","In this scenario, the findings indicate that the Bluetooth MAS is not compatible with modern messaging applications requiring Email or MMS support. This limitation necessitates alternative solutions such as using different devices, enhancing protocols, or employing additional software layers to bridge functionality gaps."
How would you construct a Wireshark filter to capture only the LTE RSTD Inter-Frequency Information messages with an inter-frequency information presence indicator set to '1'?,"In Wireshark, you can use the display filter: `lte-rrc.RSTD_InterFreqInfo_r10 == 1`. This filter will capture only those packets where the inter-frequency information presence indicator is set to '1'."
Explain how you would use tcpdump to capture packets that show errors in uplink DCCH message transmission for both r15 and r16 versions.,"To use `tcpdump` for capturing packets with errors in uplink DCCH messages, you need a filter expression compatible with tcpdump syntax. Assuming the specific fields can be identified by their protocol names and values, an example command might look like: `sudo tcpdump -i any 'lte-rrc.ul_DCCH_MessageNR_r15 == ""error"" or lte-rrc.ul_DCCH_MessageNR_r16 == ""error""'`. Note that actual field matching syntax may need adjustment based on the specific capabilities and support of your `tcpdump` tool for LTE RRC protocol fields."
How would you construct a Wireshark filter to identify packets where both LTE RRC TDD_Add_UE_EUTRA_Capabilities_v1430 and v1510 elements are marked as 'supported'?,"In Wireshark, you can construct the following display filter: `lte-rrc.tdd_Add_UE_EUTRA_Capabilities_v1430_element == 'supported' && lte-rrc.tdd_Add_UE_EUTRA_Capabilities_v1510_element == 'supported'`. This filter will highlight packets where both specified elements are marked as supported."
How would you construct a Wireshark filter to identify LTE RRC messages with explicit values greater than 100000?,"To construct a Wireshark filter for identifying LTE RRC messages with explicit values greater than 100000, use the following syntax: `lte-rrc.explicitValue > 100000`. This filter will isolate packets where the `explicitValue` field in the LTE Radio Resource Control (RRC) protocol exceeds 100000."
Describe the potential impact on network operations if multiple UTRAN CSG target cells have a PLMN ID of '0'.,"If multiple UTRAN CSG target cells have a PLMN ID of '0', it could lead to significant operational disruptions. These include incorrect routing, inability for user equipment to connect or identify the correct network, and overall degraded service quality. Such issues can affect call setup, data services, and roaming capabilities within the affected network areas."
Explain the significance of the '0x1' value in the context of diameter.3gpp.ida_flags for network area restrictions.,"The '0x1' value signifies that bit 0 of the IDA flags is set, which indicates a specific restriction on network node areas according to the 3GPP Diameter protocol specifications. This flag can be used to control access or routing policies within certain parts of the network."
What does a reporting_quantity value of less than 5 in the gsm_rlcmac.bitmap_report_quantity indicate about network conditions?,"A `reporting_quantity` value of less than 5 in the `gsm_rlcmac.bitmap_report_quantity` indicates potential issues such as poor signal quality or network congestion. This low value suggests that fewer measurements are being reported, which can be a sign of suboptimal network performance."
What network event could potentially be identified by analyzing packets where `gtpv2.ext_tra_info_loi.ggsn.gi == False` in GTPv2 traffic?,"Analyzing packets with `gtpv2.ext_tra_info_loi.ggsn.gi == false` can help identify network events such as interface failures, misconfigurations, or routing issues where the Gi interface is expected but inactive."
What are some common causes of IPv6CP option length mismatches in packet captures?,"Common causes of IPv6CP option length mismatches include misconfigured networking devices that generate incorrect packet formats, software bugs or glitches within network stack implementations, and malicious activities where attackers deliberately send malformed packets to exploit vulnerabilities. Other possibilities involve hardware malfunctions or errors during data transmission that corrupt packet contents."
What steps would you take after identifying packets with a mac_MainConfig value of 0 to resolve potential configuration issues in an LTE network?,"After identification, review logs and configurations at both UE and eNodeB for discrepancies or errors. Verify synchronization protocols, check for software updates or patches, ensure correct parameter settings, and conduct tests under varying conditions. Collaboration with equipment vendors might be necessary if hardware faults are suspected."
"What troubleshooting steps would you recommend if a large number of packets are captured with `lte-rrc.q_QualMinWB_r12 < -9`, indicating poor wideband signal quality?","If many packets show poor wideband signal quality, start by checking physical obstructions and interference sources. Verify network hardware and configurations for errors or misalignments. Analyze SINR and RSRP values to identify specific issues like high interference. Engage with network operators to adjust cell site parameters or deploy additional infrastructure if needed."
What steps would you take in tcpdump to filter out packets that do not indicate a trusted N3GA network location based on the diameter.3gpp.feature_list2_rx_flags_bit12 bit flag?,"To filter out packets that do not indicate a trusted N3GA network location using tcpdump, use a negation of the condition in your capture command: `tcpdump -nn 'diameter.3gpp and not (diameter.3gpp.feature_list2_rx_flags_bit12 == true)'`. This will exclude any packet where this bit flag is set to true, thus focusing on those that do not meet the trusted N3GA criteria."
"If you observe that 'lte-rrc.phr_ModeOtherCG_r12' is set to 1 in a captured PCAP file, what potential impact could this have on the network's performance and user experience?","When 'lte-rrc.phr_ModeOtherCG_r12' is set to 1, it indicates PHR mode is active for other cell groups. This can lead to improved power control efficiency, reduced interference, better signal quality, and potentially enhanced user throughput and overall network performance."
"How might packet loss or high latency correlate with `lte-rrc.dl_ChannelQualityReporting_r16` values less than 50, and what additional metrics could be helpful in analyzing this correlation?","`lte-rrc.dl_ChannelQualityReporting_r16` values below 50 can lead to higher packet loss rates due to the need for retransmissions when errors occur. High latency may also result from these conditions as more time is spent on error correction and retransmission processes. Additional metrics like `rlc/AM/UL_HARQ_Information` for retransmission counts, `mac/MAC_CE_Status` for HARQ feedback statistics, and RTT measurements can provide a comprehensive view of the correlation."
